{"conditions":{"scarcity_frozen":{"directionalReproducibility":0.23622342658558182,"extinctionCount":0,"medianFinalRuleDiversity":0.07252681274690403,"medianLineageDiversity":0.28419231958157765,"medianPopulationRecovery":0.10002747252747253,"medianRuleDisplacement":0.13090458083381037,"medianRulePathLength":0.42678453055703114,"runCount":12},"scarcity_mutable":{"directionalReproducibility":0.3970210236134301,"extinctionCount":0,"medianFinalRuleDiversity":0.08471873399687713,"medianLineageDiversity":0.25688521341031656,"medianPopulationRecovery":0.11493281998899976,"medianRuleDisplacement":0.1766303927422407,"medianRulePathLength":0.4466023800618508,"runCount":12},"stable_mutable":{"directionalReproducibility":0.6036276055179305,"extinctionCount":0,"medianFinalRuleDiversity":0.09726851516969834,"medianLineageDiversity":0.5117582200513705,"medianPopulationRecovery":0.5343353842342157,"medianRuleDisplacement":0.14504951590686835,"medianRulePathLength":0.286103045818095,"runCount":12}},"design":{"conditions":["stable_mutable","scarcity_mutable","scarcity_frozen"],"primaryCriteria":{"scarcityDirectionallyReproducible":">= 0.20 mean pairwise cosine","scarcityExceedsFrozenDisplacement":">= +0.010 normalized rule distance","scarcityExceedsStableDisplacement":">= +0.015 normalized rule distance","scarcityPopulationPersists":"extinction count <= 25% of seeds (minimum tolerance 1)"},"ruleDimensions":["forage_weight","hazard_avoidance","exploration","reproduction_threshold"],"seedCount":12,"seeds":[13001,13007,13019,13033,13049,13063,13079,13099,13121,13139,13159,13177]},"experimentId":"RUL-020","interpretationBoundary":["RUL-020 is a first mutable-rule ALife pilot, not evidence of biological evolution or universal adaptation.","Population-level rule-centroid motion can arise from selection on standing variation as well as mutation; the scarcity_frozen control separates these contributions only within this model.","Directional reproducibility is measured in the declared normalized four-dimensional rule coordinates and is representation dependent.","The scarcity intervention is an engineered resource-regeneration shock; PCC language is not assigned to these conditions in RUL-020."],"observerId":"OBSERVER-ALIFE-RULE-MOTION","primaryTest":{"criteriaPassed":4,"criteriaTotal":4,"pilotSupported":true,"scarcityDirectionallyReproducible":true,"scarcityExceedsFrozenDisplacement":true,"scarcityExceedsStableDisplacement":true,"scarcityPopulationPersists":true},"ruleSpaceId":"RSPACE-ALIFE-001","schemaVersion":"entropy-rulial-alife-motion/1.0.0","simulation":{"initialPopulation":72,"populationCap":150,"runCount":36,"shockStep":130,"steps":260}}
